No.     Time           Source                Destination           Protocol Length Info
      1 0.000000       192.168.1.130         192.168.1.143         TCP      78     61894 → 443 [SYN] Seq=0 Win=65535 Len=0 MSS=1460 WS=8 TSval=496067465 TSecr=0 SACK_PERM=1

Frame 1: 78 bytes on wire (624 bits), 78 bytes captured (624 bits)
Ethernet II, Src: Apple_4a:f3:1f (c8:2a:14:4a:f3:1f), Dst: Vmware_ae:e4:60 (00:0c:29:ae:e4:60)
    Destination: Vmware_ae:e4:60 (00:0c:29:ae:e4:60)
    Source: Apple_4a:f3:1f (c8:2a:14:4a:f3:1f)
    Type: IPv4 (0x0800)
Internet Protocol Version 4, Src: 192.168.1.130, Dst: 192.168.1.143
    0100 .... = Version: 4
    .... 0101 = Header Length: 20 bytes (5)
    Differentiated Services Field: 0x00 (DSCP: CS0, ECN: Not-ECT)
    Total Length: 64
    Identification: 0x1d5e (7518)
    Flags: 0x4000, Don't fragment
    Time to live: 64
    Protocol: TCP (6)
    Header checksum: 0x98f8 [validation disabled]
    [Header checksum status: Unverified]
    Source: 192.168.1.130
    Destination: 192.168.1.143
Transmission Control Protocol, Src Port: 61894, Dst Port: 443, Seq: 0, Len: 0
    Source Port: 61894
    Destination Port: 443
    [Stream index: 0]
    [TCP Segment Len: 0]
    Sequence number: 0    (relative sequence number)
    [Next sequence number: 0    (relative sequence number)]
    Acknowledgment number: 0
    1011 .... = Header Length: 44 bytes (11)
    Flags: 0x002 (SYN)
    Window size value: 65535
    [Calculated window size: 65535]
    Checksum: 0x8684 [unverified]
    [Checksum Status: Unverified]
    Urgent pointer: 0
    Options: (24 bytes), Maximum segment size, No-Operation (NOP), Window scale, No-Operation (NOP), No-Operation (NOP), Timestamps, SACK permitted, End of Option List (EOL)
    [Timestamps]

No.     Time           Source                Destination           Protocol Length Info
      2 0.000092       192.168.1.143         192.168.1.130         TCP      74     443 → 61894 [SYN, ACK] Seq=0 Ack=1 Win=14480 Len=0 MSS=1460 SACK_PERM=1 TSval=1680163 TSecr=496067465 WS=16

Frame 2: 74 bytes on wire (592 bits), 74 bytes captured (592 bits)
Ethernet II, Src: Vmware_ae:e4:60 (00:0c:29:ae:e4:60), Dst: Apple_4a:f3:1f (c8:2a:14:4a:f3:1f)
    Destination: Apple_4a:f3:1f (c8:2a:14:4a:f3:1f)
    Source: Vmware_ae:e4:60 (00:0c:29:ae:e4:60)
    Type: IPv4 (0x0800)
Internet Protocol Version 4, Src: 192.168.1.143, Dst: 192.168.1.130
    0100 .... = Version: 4
    .... 0101 = Header Length: 20 bytes (5)
    Differentiated Services Field: 0x00 (DSCP: CS0, ECN: Not-ECT)
    Total Length: 60
    Identification: 0x0000 (0)
    Flags: 0x4000, Don't fragment
    Time to live: 64
    Protocol: TCP (6)
    Header checksum: 0xb65a [validation disabled]
    [Header checksum status: Unverified]
    Source: 192.168.1.143
    Destination: 192.168.1.130
Transmission Control Protocol, Src Port: 443, Dst Port: 61894, Seq: 0, Ack: 1, Len: 0
    Source Port: 443
    Destination Port: 61894
    [Stream index: 0]
    [TCP Segment Len: 0]
    Sequence number: 0    (relative sequence number)
    [Next sequence number: 0    (relative sequence number)]
    Acknowledgment number: 1    (relative ack number)
    1010 .... = Header Length: 40 bytes (10)
    Flags: 0x012 (SYN, ACK)
    Window size value: 14480
    [Calculated window size: 14480]
    Checksum: 0x8490 [unverified]
    [Checksum Status: Unverified]
    Urgent pointer: 0
    Options: (20 bytes), Maximum segment size, SACK permitted, Timestamps, No-Operation (NOP), Window scale
    [SEQ/ACK analysis]
    [Timestamps]

No.     Time           Source                Destination           Protocol Length Info
      3 0.000270       192.168.1.130         192.168.1.143         TCP      66     61894 → 443 [ACK] Seq=1 Ack=1 Win=524280 Len=0 TSval=496067465 TSecr=1680163

Frame 3: 66 bytes on wire (528 bits), 66 bytes captured (528 bits)
Ethernet II, Src: Apple_4a:f3:1f (c8:2a:14:4a:f3:1f), Dst: Vmware_ae:e4:60 (00:0c:29:ae:e4:60)
    Destination: Vmware_ae:e4:60 (00:0c:29:ae:e4:60)
    Source: Apple_4a:f3:1f (c8:2a:14:4a:f3:1f)
    Type: IPv4 (0x0800)
Internet Protocol Version 4, Src: 192.168.1.130, Dst: 192.168.1.143
    0100 .... = Version: 4
    .... 0101 = Header Length: 20 bytes (5)
    Differentiated Services Field: 0x00 (DSCP: CS0, ECN: Not-ECT)
    Total Length: 52
    Identification: 0x9b31 (39729)
    Flags: 0x4000, Don't fragment
    Time to live: 64
    Protocol: TCP (6)
    Header checksum: 0x1b31 [validation disabled]
    [Header checksum status: Unverified]
    Source: 192.168.1.130
    Destination: 192.168.1.143
Transmission Control Protocol, Src Port: 61894, Dst Port: 443, Seq: 1, Ack: 1, Len: 0
    Source Port: 61894
    Destination Port: 443
    [Stream index: 0]
    [TCP Segment Len: 0]
    Sequence number: 1    (relative sequence number)
    [Next sequence number: 1    (relative sequence number)]
    Acknowledgment number: 1    (relative ack number)
    1000 .... = Header Length: 32 bytes (8)
    Flags: 0x010 (ACK)
    Window size value: 65535
    [Calculated window size: 524280]
    [Window size scaling factor: 8]
    Checksum: 0x989a [unverified]
    [Checksum Status: Unverified]
    Urgent pointer: 0
    Options: (12 bytes), No-Operation (NOP), No-Operation (NOP), Timestamps
    [SEQ/ACK analysis]
    [Timestamps]

No.     Time           Source                Destination           Protocol Length Info
      4 0.000493       192.168.1.130         192.168.1.143         TCP      78     61895 → 443 [SYN] Seq=0 Win=65535 Len=0 MSS=1460 WS=8 TSval=496067465 TSecr=0 SACK_PERM=1

Frame 4: 78 bytes on wire (624 bits), 78 bytes captured (624 bits)
Ethernet II, Src: Apple_4a:f3:1f (c8:2a:14:4a:f3:1f), Dst: Vmware_ae:e4:60 (00:0c:29:ae:e4:60)
    Destination: Vmware_ae:e4:60 (00:0c:29:ae:e4:60)
    Source: Apple_4a:f3:1f (c8:2a:14:4a:f3:1f)
    Type: IPv4 (0x0800)
Internet Protocol Version 4, Src: 192.168.1.130, Dst: 192.168.1.143
    0100 .... = Version: 4
    .... 0101 = Header Length: 20 bytes (5)
    Differentiated Services Field: 0x00 (DSCP: CS0, ECN: Not-ECT)
    Total Length: 64
    Identification: 0x5e66 (24166)
    Flags: 0x4000, Don't fragment
    Time to live: 64
    Protocol: TCP (6)
    Header checksum: 0x57f0 [validation disabled]
    [Header checksum status: Unverified]
    Source: 192.168.1.130
    Destination: 192.168.1.143
Transmission Control Protocol, Src Port: 61895, Dst Port: 443, Seq: 0, Len: 0
    Source Port: 61895
    Destination Port: 443
    [Stream index: 1]
    [TCP Segment Len: 0]
    Sequence number: 0    (relative sequence number)
    [Next sequence number: 0    (relative sequence number)]
    Acknowledgment number: 0
    1011 .... = Header Length: 44 bytes (11)
    Flags: 0x002 (SYN)
    Window size value: 65535
    [Calculated window size: 65535]
    Checksum: 0x1ceb [unverified]
    [Checksum Status: Unverified]
    Urgent pointer: 0
    Options: (24 bytes), Maximum segment size, No-Operation (NOP), Window scale, No-Operation (NOP), No-Operation (NOP), Timestamps, SACK permitted, End of Option List (EOL)
    [Timestamps]

No.     Time           Source                Destination           Protocol Length Info
      5 0.000507       192.168.1.143         192.168.1.130         TCP      74     443 → 61895 [SYN, ACK] Seq=0 Ack=1 Win=14480 Len=0 MSS=1460 SACK_PERM=1 TSval=1680163 TSecr=496067465 WS=16

Frame 5: 74 bytes on wire (592 bits), 74 bytes captured (592 bits)
Ethernet II, Src: Vmware_ae:e4:60 (00:0c:29:ae:e4:60), Dst: Apple_4a:f3:1f (c8:2a:14:4a:f3:1f)
    Destination: Apple_4a:f3:1f (c8:2a:14:4a:f3:1f)
    Source: Vmware_ae:e4:60 (00:0c:29:ae:e4:60)
    Type: IPv4 (0x0800)
Internet Protocol Version 4, Src: 192.168.1.143, Dst: 192.168.1.130
    0100 .... = Version: 4
    .... 0101 = Header Length: 20 bytes (5)
    Differentiated Services Field: 0x00 (DSCP: CS0, ECN: Not-ECT)
    Total Length: 60
    Identification: 0x0000 (0)
    Flags: 0x4000, Don't fragment
    Time to live: 64
    Protocol: TCP (6)
    Header checksum: 0xb65a [validation disabled]
    [Header checksum status: Unverified]
    Source: 192.168.1.143
    Destination: 192.168.1.130
Transmission Control Protocol, Src Port: 443, Dst Port: 61895, Seq: 0, Ack: 1, Len: 0
    Source Port: 443
    Destination Port: 61895
    [Stream index: 1]
    [TCP Segment Len: 0]
    Sequence number: 0    (relative sequence number)
    [Next sequence number: 0    (relative sequence number)]
    Acknowledgment number: 1    (relative ack number)
    1010 .... = Header Length: 40 bytes (10)
    Flags: 0x012 (SYN, ACK)
    Window size value: 14480
    [Calculated window size: 14480]
    Checksum: 0x8490 [unverified]
    [Checksum Status: Unverified]
    Urgent pointer: 0
    Options: (20 bytes), Maximum segment size, SACK permitted, Timestamps, No-Operation (NOP), Window scale
    [SEQ/ACK analysis]
    [Timestamps]

No.     Time           Source                Destination           Protocol Length Info
      6 0.000604       192.168.1.130         192.168.1.143         TCP      66     61895 → 443 [ACK] Seq=1 Ack=1 Win=524280 Len=0 TSval=496067465 TSecr=1680163

Frame 6: 66 bytes on wire (528 bits), 66 bytes captured (528 bits)
Ethernet II, Src: Apple_4a:f3:1f (c8:2a:14:4a:f3:1f), Dst: Vmware_ae:e4:60 (00:0c:29:ae:e4:60)
    Destination: Vmware_ae:e4:60 (00:0c:29:ae:e4:60)
    Source: Apple_4a:f3:1f (c8:2a:14:4a:f3:1f)
    Type: IPv4 (0x0800)
Internet Protocol Version 4, Src: 192.168.1.130, Dst: 192.168.1.143
    0100 .... = Version: 4
    .... 0101 = Header Length: 20 bytes (5)
    Differentiated Services Field: 0x00 (DSCP: CS0, ECN: Not-ECT)
    Total Length: 52
    Identification: 0x9461 (37985)
    Flags: 0x4000, Don't fragment
    Time to live: 64
    Protocol: TCP (6)
    Header checksum: 0x2201 [validation disabled]
    [Header checksum status: Unverified]
    Source: 192.168.1.130
    Destination: 192.168.1.143
Transmission Control Protocol, Src Port: 61895, Dst Port: 443, Seq: 1, Ack: 1, Len: 0
    Source Port: 61895
    Destination Port: 443
    [Stream index: 1]
    [TCP Segment Len: 0]
    Sequence number: 1    (relative sequence number)
    [Next sequence number: 1    (relative sequence number)]
    Acknowledgment number: 1    (relative ack number)
    1000 .... = Header Length: 32 bytes (8)
    Flags: 0x010 (ACK)
    Window size value: 65535
    [Calculated window size: 524280]
    [Window size scaling factor: 8]
    Checksum: 0x9819 [unverified]
    [Checksum Status: Unverified]
    Urgent pointer: 0
    Options: (12 bytes), No-Operation (NOP), No-Operation (NOP), Timestamps
    [SEQ/ACK analysis]
    [Timestamps]

No.     Time           Source                Destination           Protocol Length Info
      7 0.000646       192.168.1.130         192.168.1.143         TCP      78     61896 → 443 [SYN] Seq=0 Win=65535 Len=0 MSS=1460 WS=8 TSval=496067465 TSecr=0 SACK_PERM=1

Frame 7: 78 bytes on wire (624 bits), 78 bytes captured (624 bits)
Ethernet II, Src: Apple_4a:f3:1f (c8:2a:14:4a:f3:1f), Dst: Vmware_ae:e4:60 (00:0c:29:ae:e4:60)
    Destination: Vmware_ae:e4:60 (00:0c:29:ae:e4:60)
    Source: Apple_4a:f3:1f (c8:2a:14:4a:f3:1f)
    Type: IPv4 (0x0800)
Internet Protocol Version 4, Src: 192.168.1.130, Dst: 192.168.1.143
    0100 .... = Version: 4
    .... 0101 = Header Length: 20 bytes (5)
    Differentiated Services Field: 0x00 (DSCP: CS0, ECN: Not-ECT)
    Total Length: 64
    Identification: 0x951f (38175)
    Flags: 0x4000, Don't fragment
    Time to live: 64
    Protocol: TCP (6)
    Header checksum: 0x2137 [validation disabled]
    [Header checksum status: Unverified]
    Source: 192.168.1.130
    Destination: 192.168.1.143
Transmission Control Protocol, Src Port: 61896, Dst Port: 443, Seq: 0, Len: 0
    Source Port: 61896
    Destination Port: 443
    [Stream index: 2]
    [TCP Segment Len: 0]
    Sequence number: 0    (relative sequence number)
    [Next sequence number: 0    (relative sequence number)]
    Acknowledgment number: 0
    1011 .... = Header Length: 44 bytes (11)
    Flags: 0x002 (SYN)
    Window size value: 65535
    [Calculated window size: 65535]
    Checksum: 0x94f1 [unverified]
    [Checksum Status: Unverified]
    Urgent pointer: 0
    Options: (24 bytes), Maximum segment size, No-Operation (NOP), Window scale, No-Operation (NOP), No-Operation (NOP), Timestamps, SACK permitted, End of Option List (EOL)
    [Timestamps]

No.     Time           Source                Destination           Protocol Length Info
      8 0.000658       192.168.1.143         192.168.1.130         TCP      74     443 → 61896 [SYN, ACK] Seq=0 Ack=1 Win=14480 Len=0 MSS=1460 SACK_PERM=1 TSval=1680163 TSecr=496067465 WS=16

Frame 8: 74 bytes on wire (592 bits), 74 bytes captured (592 bits)
Ethernet II, Src: Vmware_ae:e4:60 (00:0c:29:ae:e4:60), Dst: Apple_4a:f3:1f (c8:2a:14:4a:f3:1f)
    Destination: Apple_4a:f3:1f (c8:2a:14:4a:f3:1f)
    Source: Vmware_ae:e4:60 (00:0c:29:ae:e4:60)
    Type: IPv4 (0x0800)
Internet Protocol Version 4, Src: 192.168.1.143, Dst: 192.168.1.130
    0100 .... = Version: 4
    .... 0101 = Header Length: 20 bytes (5)
    Differentiated Services Field: 0x00 (DSCP: CS0, ECN: Not-ECT)
    Total Length: 60
    Identification: 0x0000 (0)
    Flags: 0x4000, Don't fragment
    Time to live: 64
    Protocol: TCP (6)
    Header checksum: 0xb65a [validation disabled]
    [Header checksum status: Unverified]
    Source: 192.168.1.143
    Destination: 192.168.1.130
Transmission Control Protocol, Src Port: 443, Dst Port: 61896, Seq: 0, Ack: 1, Len: 0
    Source Port: 443
    Destination Port: 61896
    [Stream index: 2]
    [TCP Segment Len: 0]
    Sequence number: 0    (relative sequence number)
    [Next sequence number: 0    (relative sequence number)]
    Acknowledgment number: 1    (relative ack number)
    1010 .... = Header Length: 40 bytes (10)
    Flags: 0x012 (SYN, ACK)
    Window size value: 14480
    [Calculated window size: 14480]
    Checksum: 0x8490 [unverified]
    [Checksum Status: Unverified]
    Urgent pointer: 0
    Options: (20 bytes), Maximum segment size, SACK permitted, Timestamps, No-Operation (NOP), Window scale
    [SEQ/ACK analysis]
    [Timestamps]

No.     Time           Source                Destination           Protocol Length Info
      9 0.000832       192.168.1.130         192.168.1.143         TCP      66     61896 → 443 [ACK] Seq=1 Ack=1 Win=524280 Len=0 TSval=496067465 TSecr=1680163

Frame 9: 66 bytes on wire (528 bits), 66 bytes captured (528 bits)
Ethernet II, Src: Apple_4a:f3:1f (c8:2a:14:4a:f3:1f), Dst: Vmware_ae:e4:60 (00:0c:29:ae:e4:60)
    Destination: Vmware_ae:e4:60 (00:0c:29:ae:e4:60)
    Source: Apple_4a:f3:1f (c8:2a:14:4a:f3:1f)
    Type: IPv4 (0x0800)
Internet Protocol Version 4, Src: 192.168.1.130, Dst: 192.168.1.143
    0100 .... = Version: 4
    .... 0101 = Header Length: 20 bytes (5)
    Differentiated Services Field: 0x00 (DSCP: CS0, ECN: Not-ECT)
    Total Length: 52
    Identification: 0x5265 (21093)
    Flags: 0x4000, Don't fragment
    Time to live: 64
    Protocol: TCP (6)
    Header checksum: 0x63fd [validation disabled]
    [Header checksum status: Unverified]
    Source: 192.168.1.130
    Destination: 192.168.1.143
Transmission Control Protocol, Src Port: 61896, Dst Port: 443, Seq: 1, Ack: 1, Len: 0
    Source Port: 61896
    Destination Port: 443
    [Stream index: 2]
    [TCP Segment Len: 0]
    Sequence number: 1    (relative sequence number)
    [Next sequence number: 1    (relative sequence number)]
    Acknowledgment number: 1    (relative ack number)
    1000 .... = Header Length: 32 bytes (8)
    Flags: 0x010 (ACK)
    Window size value: 65535
    [Calculated window size: 524280]
    [Window size scaling factor: 8]
    Checksum: 0xd99a [unverified]
    [Checksum Status: Unverified]
    Urgent pointer: 0
    Options: (12 bytes), No-Operation (NOP), No-Operation (NOP), Timestamps
    [SEQ/ACK analysis]
    [Timestamps]

No.     Time           Source                Destination           Protocol Length Info
     10 0.000851       192.168.1.130         192.168.1.143         TCP      78     61897 → 443 [SYN] Seq=0 Win=65535 Len=0 MSS=1460 WS=8 TSval=496067465 TSecr=0 SACK_PERM=1

Frame 10: 78 bytes on wire (624 bits), 78 bytes captured (624 bits)
Ethernet II, Src: Apple_4a:f3:1f (c8:2a:14:4a:f3:1f), Dst: Vmware_ae:e4:60 (00:0c:29:ae:e4:60)
    Destination: Vmware_ae:e4:60 (00:0c:29:ae:e4:60)
    Source: Apple_4a:f3:1f (c8:2a:14:4a:f3:1f)
    Type: IPv4 (0x0800)
Internet Protocol Version 4, Src: 192.168.1.130, Dst: 192.168.1.143
    0100 .... = Version: 4
    .... 0101 = Header Length: 20 bytes (5)
    Differentiated Services Field: 0x00 (DSCP: CS0, ECN: Not-ECT)
    Total Length: 64
    Identification: 0x4f2b (20267)
    Flags: 0x4000, Don't fragment
    Time to live: 64
    Protocol: TCP (6)
    Header checksum: 0x672b [validation disabled]
    [Header checksum status: Unverified]
    Source: 192.168.1.130
    Destination: 192.168.1.143
Transmission Control Protocol, Src Port: 61897, Dst Port: 443, Seq: 0, Len: 0
    Source Port: 61897
    Destination Port: 443
    [Stream index: 3]
    [TCP Segment Len: 0]
    Sequence number: 0    (relative sequence number)
    [Next sequence number: 0    (relative sequence number)]
    Acknowledgment number: 0
    1011 .... = Header Length: 44 bytes (11)
    Flags: 0x002 (SYN)
    Window size value: 65535
    [Calculated window size: 65535]
    Checksum: 0xcf7e [unverified]
    [Checksum Status: Unverified]
    Urgent pointer: 0
    Options: (24 bytes), Maximum segment size, No-Operation (NOP), Window scale, No-Operation (NOP), No-Operation (NOP), Timestamps, SACK permitted, End of Option List (EOL)
    [Timestamps]

No.     Time           Source                Destination           Protocol Length Info
     11 0.000861       192.168.1.143         192.168.1.130         TCP      74     443 → 61897 [SYN, ACK] Seq=0 Ack=1 Win=14480 Len=0 MSS=1460 SACK_PERM=1 TSval=1680163 TSecr=496067465 WS=16

Frame 11: 74 bytes on wire (592 bits), 74 bytes captured (592 bits)
Ethernet II, Src: Vmware_ae:e4:60 (00:0c:29:ae:e4:60), Dst: Apple_4a:f3:1f (c8:2a:14:4a:f3:1f)
    Destination: Apple_4a:f3:1f (c8:2a:14:4a:f3:1f)
    Source: Vmware_ae:e4:60 (00:0c:29:ae:e4:60)
    Type: IPv4 (0x0800)
Internet Protocol Version 4, Src: 192.168.1.143, Dst: 192.168.1.130
    0100 .... = Version: 4
    .... 0101 = Header Length: 20 bytes (5)
    Differentiated Services Field: 0x00 (DSCP: CS0, ECN: Not-ECT)
    Total Length: 60
    Identification: 0x0000 (0)
    Flags: 0x4000, Don't fragment
    Time to live: 64
    Protocol: TCP (6)
    Header checksum: 0xb65a [validation disabled]
    [Header checksum status: Unverified]
    Source: 192.168.1.143
    Destination: 192.168.1.130
Transmission Control Protocol, Src Port: 443, Dst Port: 61897, Seq: 0, Ack: 1, Len: 0
    Source Port: 443
    Destination Port: 61897
    [Stream index: 3]
    [TCP Segment Len: 0]
    Sequence number: 0    (relative sequence number)
    [Next sequence number: 0    (relative sequence number)]
    Acknowledgment number: 1    (relative ack number)
    1010 .... = Header Length: 40 bytes (10)
    Flags: 0x012 (SYN, ACK)
    Window size value: 14480
    [Calculated window size: 14480]
    Checksum: 0x8490 [unverified]
    [Checksum Status: Unverified]
    Urgent pointer: 0
    Options: (20 bytes), Maximum segment size, SACK permitted, Timestamps, No-Operation (NOP), Window scale
    [SEQ/ACK analysis]
    [Timestamps]

No.     Time           Source                Destination           Protocol Length Info
     12 0.001089       192.168.1.130         192.168.1.143         TCP      66     61897 → 443 [ACK] Seq=1 Ack=1 Win=524280 Len=0 TSval=496067466 TSecr=1680163

Frame 12: 66 bytes on wire (528 bits), 66 bytes captured (528 bits)
Ethernet II, Src: Apple_4a:f3:1f (c8:2a:14:4a:f3:1f), Dst: Vmware_ae:e4:60 (00:0c:29:ae:e4:60)
    Destination: Vmware_ae:e4:60 (00:0c:29:ae:e4:60)
    Source: Apple_4a:f3:1f (c8:2a:14:4a:f3:1f)
    Type: IPv4 (0x0800)
Internet Protocol Version 4, Src: 192.168.1.130, Dst: 192.168.1.143
    0100 .... = Version: 4
    .... 0101 = Header Length: 20 bytes (5)
    Differentiated Services Field: 0x00 (DSCP: CS0, ECN: Not-ECT)
    Total Length: 52
    Identification: 0xf01d (61469)
    Flags: 0x4000, Don't fragment
    Time to live: 64
    Protocol: TCP (6)
    Header checksum: 0xc644 [validation disabled]
    [Header checksum status: Unverified]
    Source: 192.168.1.130
    Destination: 192.168.1.143
Transmission Control Protocol, Src Port: 61897, Dst Port: 443, Seq: 1, Ack: 1, Len: 0
    Source Port: 61897
    Destination Port: 443
    [Stream index: 3]
    [TCP Segment Len: 0]
    Sequence number: 1    (relative sequence number)
    [Next sequence number: 1    (relative sequence number)]
    Acknowledgment number: 1    (relative ack number)
    1000 .... = Header Length: 32 bytes (8)
    Flags: 0x010 (ACK)
    Window size value: 65535
    [Calculated window size: 524280]
    [Window size scaling factor: 8]
    Checksum: 0xc4e3 [unverified]
    [Checksum Status: Unverified]
    Urgent pointer: 0
    Options: (12 bytes), No-Operation (NOP), No-Operation (NOP), Timestamps
    [SEQ/ACK analysis]
    [Timestamps]

No.     Time           Source                Destination           Protocol Length Info
     13 0.001158       192.168.1.130         192.168.1.143         TCP      78     61898 → 443 [SYN] Seq=0 Win=65535 Len=0 MSS=1460 WS=8 TSval=496067466 TSecr=0 SACK_PERM=1

Frame 13: 78 bytes on wire (624 bits), 78 bytes captured (624 bits)
Ethernet II, Src: Apple_4a:f3:1f (c8:2a:14:4a:f3:1f), Dst: Vmware_ae:e4:60 (00:0c:29:ae:e4:60)
    Destination: Vmware_ae:e4:60 (00:0c:29:ae:e4:60)
    Source: Apple_4a:f3:1f (c8:2a:14:4a:f3:1f)
    Type: IPv4 (0x0800)
Internet Protocol Version 4, Src: 192.168.1.130, Dst: 192.168.1.143
    0100 .... = Version: 4
    .... 0101 = Header Length: 20 bytes (5)
    Differentiated Services Field: 0x00 (DSCP: CS0, ECN: Not-ECT)
    Total Length: 64
    Identification: 0x547e (21630)
    Flags: 0x4000, Don't fragment
    Time to live: 64
    Protocol: TCP (6)
    Header checksum: 0x61d8 [validation disabled]
    [Header checksum status: Unverified]
    Source: 192.168.1.130
    Destination: 192.168.1.143
Transmission Control Protocol, Src Port: 61898, Dst Port: 443, Seq: 0, Len: 0
    Source Port: 61898
    Destination Port: 443
    [Stream index: 4]
    [TCP Segment Len: 0]
    Sequence number: 0    (relative sequence number)
    [Next sequence number: 0    (relative sequence number)]
    Acknowledgment number: 0
    1011 .... = Header Length: 44 bytes (11)
    Flags: 0x002 (SYN)
    Window size value: 65535
    [Calculated window size: 65535]
    Checksum: 0x8508 [unverified]
    [Checksum Status: Unverified]
    Urgent pointer: 0
    Options: (24 bytes), Maximum segment size, No-Operation (NOP), Window scale, No-Operation (NOP), No-Operation (NOP), Timestamps, SACK permitted, End of Option List (EOL)
    [Timestamps]

No.     Time           Source                Destination           Protocol Length Info
     14 0.001169       192.168.1.143         192.168.1.130         TCP      74     443 → 61898 [SYN, ACK] Seq=0 Ack=1 Win=14480 Len=0 MSS=1460 SACK_PERM=1 TSval=1680164 TSecr=496067466 WS=16

Frame 14: 74 bytes on wire (592 bits), 74 bytes captured (592 bits)
Ethernet II, Src: Vmware_ae:e4:60 (00:0c:29:ae:e4:60), Dst: Apple_4a:f3:1f (c8:2a:14:4a:f3:1f)
    Destination: Apple_4a:f3:1f (c8:2a:14:4a:f3:1f)
    Source: Vmware_ae:e4:60 (00:0c:29:ae:e4:60)
    Type: IPv4 (0x0800)
Internet Protocol Version 4, Src: 192.168.1.143, Dst: 192.168.1.130
    0100 .... = Version: 4
    .... 0101 = Header Length: 20 bytes (5)
    Differentiated Services Field: 0x00 (DSCP: CS0, ECN: Not-ECT)
    Total Length: 60
    Identification: 0x0000 (0)
    Flags: 0x4000, Don't fragment
    Time to live: 64
    Protocol: TCP (6)
    Header checksum: 0xb65a [validation disabled]
    [Header checksum status: Unverified]
    Source: 192.168.1.143
    Destination: 192.168.1.130
Transmission Control Protocol, Src Port: 443, Dst Port: 61898, Seq: 0, Ack: 1, Len: 0
    Source Port: 443
    Destination Port: 61898
    [Stream index: 4]
    [TCP Segment Len: 0]
    Sequence number: 0    (relative sequence number)
    [Next sequence number: 0    (relative sequence number)]
    Acknowledgment number: 1    (relative ack number)
    1010 .... = Header Length: 40 bytes (10)
    Flags: 0x012 (SYN, ACK)
    Window size value: 14480
    [Calculated window size: 14480]
    Checksum: 0x8490 [unverified]
    [Checksum Status: Unverified]
    Urgent pointer: 0
    Options: (20 bytes), Maximum segment size, SACK permitted, Timestamps, No-Operation (NOP), Window scale
    [SEQ/ACK analysis]
    [Timestamps]

No.     Time           Source                Destination           Protocol Length Info
     15 0.001284       192.168.1.130         192.168.1.143         TCP      78     61899 → 443 [SYN] Seq=0 Win=65535 Len=0 MSS=1460 WS=8 TSval=496067466 TSecr=0 SACK_PERM=1

Frame 15: 78 bytes on wire (624 bits), 78 bytes captured (624 bits)
Ethernet II, Src: Apple_4a:f3:1f (c8:2a:14:4a:f3:1f), Dst: Vmware_ae:e4:60 (00:0c:29:ae:e4:60)
    Destination: Vmware_ae:e4:60 (00:0c:29:ae:e4:60)
    Source: Apple_4a:f3:1f (c8:2a:14:4a:f3:1f)
    Type: IPv4 (0x0800)
Internet Protocol Version 4, Src: 192.168.1.130, Dst: 192.168.1.143
    0100 .... = Version: 4
    .... 0101 = Header Length: 20 bytes (5)
    Differentiated Services Field: 0x00 (DSCP: CS0, ECN: Not-ECT)
    Total Length: 64
    Identification: 0xf15d (61789)
    Flags: 0x4000, Don't fragment
    Time to live: 64
    Protocol: TCP (6)
    Header checksum: 0xc4f8 [validation disabled]
    [Header checksum status: Unverified]
    Source: 192.168.1.130
    Destination: 192.168.1.143
Transmission Control Protocol, Src Port: 61899, Dst Port: 443, Seq: 0, Len: 0
    Source Port: 61899
    Destination Port: 443
    [Stream index: 5]
    [TCP Segment Len: 0]
    Sequence number: 0    (relative sequence number)
    [Next sequence number: 0    (relative sequence number)]
    Acknowledgment number: 0
    1011 .... = Header Length: 44 bytes (11)
    Flags: 0x002 (SYN)
    Window size value: 65535
    [Calculated window size: 65535]
    Checksum: 0xc481 [unverified]
    [Checksum Status: Unverified]
    Urgent pointer: 0
    Options: (24 bytes), Maximum segment size, No-Operation (NOP), Window scale, No-Operation (NOP), No-Operation (NOP), Timestamps, SACK permitted, End of Option List (EOL)
    [Timestamps]

No.     Time           Source                Destination           Protocol Length Info
     16 0.001324       192.168.1.143         192.168.1.130         TCP      74     443 → 61899 [SYN, ACK] Seq=0 Ack=1 Win=14480 Len=0 MSS=1460 SACK_PERM=1 TSval=1680164 TSecr=496067466 WS=16

Frame 16: 74 bytes on wire (592 bits), 74 bytes captured (592 bits)
Ethernet II, Src: Vmware_ae:e4:60 (00:0c:29:ae:e4:60), Dst: Apple_4a:f3:1f (c8:2a:14:4a:f3:1f)
    Destination: Apple_4a:f3:1f (c8:2a:14:4a:f3:1f)
    Source: Vmware_ae:e4:60 (00:0c:29:ae:e4:60)
    Type: IPv4 (0x0800)
Internet Protocol Version 4, Src: 192.168.1.143, Dst: 192.168.1.130
    0100 .... = Version: 4
    .... 0101 = Header Length: 20 bytes (5)
    Differentiated Services Field: 0x00 (DSCP: CS0, ECN: Not-ECT)
    Total Length: 60
    Identification: 0x0000 (0)
    Flags: 0x4000, Don't fragment
    Time to live: 64
    Protocol: TCP (6)
    Header checksum: 0xb65a [validation disabled]
    [Header checksum status: Unverified]
    Source: 192.168.1.143
    Destination: 192.168.1.130
Transmission Control Protocol, Src Port: 443, Dst Port: 61899, Seq: 0, Ack: 1, Len: 0
    Source Port: 443
    Destination Port: 61899
    [Stream index: 5]
    [TCP Segment Len: 0]
    Sequence number: 0    (relative sequence number)
    [Next sequence number: 0    (relative sequence number)]
    Acknowledgment number: 1    (relative ack number)
    1010 .... = Header Length: 40 bytes (10)
    Flags: 0x012 (SYN, ACK)
    Window size value: 14480
    [Calculated window size: 14480]
    Checksum: 0x8490 [unverified]
    [Checksum Status: Unverified]
    Urgent pointer: 0
    Options: (20 bytes), Maximum segment size, SACK permitted, Timestamps, No-Operation (NOP), Window scale
    [SEQ/ACK analysis]
    [Timestamps]

No.     Time           Source                Destination           Protocol Length Info
     17 0.001364       192.168.1.130         192.168.1.143         TCP      66     61898 → 443 [ACK] Seq=1 Ack=1 Win=524280 Len=0 TSval=496067466 TSecr=1680164

Frame 17: 66 bytes on wire (528 bits), 66 bytes captured (528 bits)
Ethernet II, Src: Apple_4a:f3:1f (c8:2a:14:4a:f3:1f), Dst: Vmware_ae:e4:60 (00:0c:29:ae:e4:60)
    Destination: Vmware_ae:e4:60 (00:0c:29:ae:e4:60)
    Source: Apple_4a:f3:1f (c8:2a:14:4a:f3:1f)
    Type: IPv4 (0x0800)
Internet Protocol Version 4, Src: 192.168.1.130, Dst: 192.168.1.143
    0100 .... = Version: 4
    .... 0101 = Header Length: 20 bytes (5)
    Differentiated Services Field: 0x00 (DSCP: CS0, ECN: Not-ECT)
    Total Length: 52
    Identification: 0x0f2c (3884)
    Flags: 0x4000, Don't fragment
    Time to live: 64
    Protocol: TCP (6)
    Header checksum: 0xa736 [validation disabled]
    [Header checksum status: Unverified]
    Source: 192.168.1.130
    Destination: 192.168.1.143
Transmission Control Protocol, Src Port: 61898, Dst Port: 443, Seq: 1, Ack: 1, Len: 0
    Source Port: 61898
    Destination Port: 443
    [Stream index: 4]
    [TCP Segment Len: 0]
    Sequence number: 1    (relative sequence number)
    [Next sequence number: 1    (relative sequence number)]
    Acknowledgment number: 1    (relative ack number)
    1000 .... = Header Length: 32 bytes (8)
    Flags: 0x010 (ACK)
    Window size value: 65535
    [Calculated window size: 524280]
    [Window size scaling factor: 8]
    Checksum: 0xe43d [unverified]
    [Checksum Status: Unverified]
    Urgent pointer: 0
    Options: (12 bytes), No-Operation (NOP), No-Operation (NOP), Timestamps
    [SEQ/ACK analysis]
    [Timestamps]

No.     Time           Source                Destination           Protocol Length Info
     18 0.001408       192.168.1.130         192.168.1.143         TCP      66     61899 → 443 [ACK] Seq=1 Ack=1 Win=524280 Len=0 TSval=496067466 TSecr=1680164

Frame 18: 66 bytes on wire (528 bits), 66 bytes captured (528 bits)
Ethernet II, Src: Apple_4a:f3:1f (c8:2a:14:4a:f3:1f), Dst: Vmware_ae:e4:60 (00:0c:29:ae:e4:60)
    Destination: Vmware_ae:e4:60 (00:0c:29:ae:e4:60)
    Source: Apple_4a:f3:1f (c8:2a:14:4a:f3:1f)
    Type: IPv4 (0x0800)
Internet Protocol Version 4, Src: 192.168.1.130, Dst: 192.168.1.143
    0100 .... = Version: 4
    .... 0101 = Header Length: 20 bytes (5)
    Differentiated Services Field: 0x00 (DSCP: CS0, ECN: Not-ECT)
    Total Length: 52
    Identification: 0x6a2f (27183)
    Flags: 0x4000, Don't fragment
    Time to live: 64
    Protocol: TCP (6)
    Header checksum: 0x4c33 [validation disabled]
    [Header checksum status: Unverified]
    Source: 192.168.1.130
    Destination: 192.168.1.143
Transmission Control Protocol, Src Port: 61899, Dst Port: 443, Seq: 1, Ack: 1, Len: 0
    Source Port: 61899
    Destination Port: 443
    [Stream index: 5]
    [TCP Segment Len: 0]
    Sequence number: 1    (relative sequence number)
    [Next sequence number: 1    (relative sequence number)]
    Acknowledgment number: 1    (relative ack number)
    1000 .... = Header Length: 32 bytes (8)
    Flags: 0x010 (ACK)
    Window size value: 65535
    [Calculated window size: 524280]
    [Window size scaling factor: 8]
    Checksum: 0x6034 [unverified]
    [Checksum Status: Unverified]
    Urgent pointer: 0
    Options: (12 bytes), No-Operation (NOP), No-Operation (NOP), Timestamps
    [SEQ/ACK analysis]
    [Timestamps]

No.     Time           Source                Destination           Protocol Length Info
     19 0.002163       192.168.1.130         192.168.1.143         TLSv1    252    Client Hello

Frame 19: 252 bytes on wire (2016 bits), 252 bytes captured (2016 bits)
Ethernet II, Src: Apple_4a:f3:1f (c8:2a:14:4a:f3:1f), Dst: Vmware_ae:e4:60 (00:0c:29:ae:e4:60)
    Destination: Vmware_ae:e4:60 (00:0c:29:ae:e4:60)
    Source: Apple_4a:f3:1f (c8:2a:14:4a:f3:1f)
    Type: IPv4 (0x0800)
Internet Protocol Version 4, Src: 192.168.1.130, Dst: 192.168.1.143
    0100 .... = Version: 4
    .... 0101 = Header Length: 20 bytes (5)
    Differentiated Services Field: 0x00 (DSCP: CS0, ECN: Not-ECT)
    Total Length: 238
    Identification: 0x5967 (22887)
    Flags: 0x4000, Don't fragment
    Time to live: 64
    Protocol: TCP (6)
    Header checksum: 0x5c41 [validation disabled]
    [Header checksum status: Unverified]
    Source: 192.168.1.130
    Destination: 192.168.1.143
Transmission Control Protocol, Src Port: 61894, Dst Port: 443, Seq: 1, Ack: 1, Len: 186
    Source Port: 61894
    Destination Port: 443
    [Stream index: 0]
    [TCP Segment Len: 186]
    Sequence number: 1    (relative sequence number)
    [Next sequence number: 187    (relative sequence number)]
    Acknowledgment number: 1    (relative ack number)
    1000 .... = Header Length: 32 bytes (8)
    Flags: 0x018 (PSH, ACK)
    Window size value: 65535
    [Calculated window size: 524280]
    [Window size scaling factor: 8]
    Checksum: 0x4ae7 [unverified]
    [Checksum Status: Unverified]
    Urgent pointer: 0
    Options: (12 bytes), No-Operation (NOP), No-Operation (NOP), Timestamps
    [SEQ/ACK analysis]
    [Timestamps]
    TCP payload (186 bytes)
Secure Sockets Layer
    TLSv1 Record Layer: Handshake Protocol: Client Hello

No.     Time           Source                Destination           Protocol Length Info
     20 0.002186       192.168.1.143         192.168.1.130         TCP      66     443 → 61894 [ACK] Seq=1 Ack=187 Win=15552 Len=0 TSval=1680164 TSecr=496067467

Frame 20: 66 bytes on wire (528 bits), 66 bytes captured (528 bits)
Ethernet II, Src: Vmware_ae:e4:60 (00:0c:29:ae:e4:60), Dst: Apple_4a:f3:1f (c8:2a:14:4a:f3:1f)
    Destination: Apple_4a:f3:1f (c8:2a:14:4a:f3:1f)
    Source: Vmware_ae:e4:60 (00:0c:29:ae:e4:60)
    Type: IPv4 (0x0800)
Internet Protocol Version 4, Src: 192.168.1.143, Dst: 192.168.1.130
    0100 .... = Version: 4
    .... 0101 = Header Length: 20 bytes (5)
    Differentiated Services Field: 0x00 (DSCP: CS0, ECN: Not-ECT)
    Total Length: 52
    Identification: 0x5c44 (23620)
    Flags: 0x4000, Don't fragment
    Time to live: 64
    Protocol: TCP (6)
    Header checksum: 0x5a1e [validation disabled]
    [Header checksum status: Unverified]
    Source: 192.168.1.143
    Destination: 192.168.1.130
Transmission Control Protocol, Src Port: 443, Dst Port: 61894, Seq: 1, Ack: 187, Len: 0
    Source Port: 443
    Destination Port: 61894
    [Stream index: 0]
    [TCP Segment Len: 0]
    Sequence number: 1    (relative sequence number)
    [Next sequence number: 1    (relative sequence number)]
    Acknowledgment number: 187    (relative ack number)
    1000 .... = Header Length: 32 bytes (8)
    Flags: 0x010 (ACK)
    Window size value: 972
    [Calculated window size: 15552]
    [Window size scaling factor: 16]
    Checksum: 0x8488 [unverified]
    [Checksum Status: Unverified]
    Urgent pointer: 0
    Options: (12 bytes), No-Operation (NOP), No-Operation (NOP), Timestamps
    [SEQ/ACK analysis]
    [Timestamps]

No.     Time           Source                Destination           Protocol Length Info
     21 0.002834       192.168.1.130         192.168.1.143         TLSv1    252    Client Hello

Frame 21: 252 bytes on wire (2016 bits), 252 bytes captured (2016 bits)
Ethernet II, Src: Apple_4a:f3:1f (c8:2a:14:4a:f3:1f), Dst: Vmware_ae:e4:60 (00:0c:29:ae:e4:60)
    Destination: Vmware_ae:e4:60 (00:0c:29:ae:e4:60)
    Source: Apple_4a:f3:1f (c8:2a:14:4a:f3:1f)
    Type: IPv4 (0x0800)
Internet Protocol Version 4, Src: 192.168.1.130, Dst: 192.168.1.143
    0100 .... = Version: 4
    .... 0101 = Header Length: 20 bytes (5)
    Differentiated Services Field: 0x00 (DSCP: CS0, ECN: Not-ECT)
    Total Length: 238
    Identification: 0x0d05 (3333)
    Flags: 0x4000, Don't fragment
    Time to live: 64
    Protocol: TCP (6)
    Header checksum: 0xa8a3 [validation disabled]
    [Header checksum status: Unverified]
    Source: 192.168.1.130
    Destination: 192.168.1.143
Transmission Control Protocol, Src Port: 61895, Dst Port: 443, Seq: 1, Ack: 1, Len: 186
    Source Port: 61895
    Destination Port: 443
    [Stream index: 1]
    [TCP Segment Len: 186]
    Sequence number: 1    (relative sequence number)
    [Next sequence number: 187    (relative sequence number)]
    Acknowledgment number: 1    (relative ack number)
    1000 .... = Header Length: 32 bytes (8)
    Flags: 0x018 (PSH, ACK)
    Window size value: 65535
    [Calculated window size: 524280]
    [Window size scaling factor: 8]
    Checksum: 0x8177 [unverified]
    [Checksum Status: Unverified]
    Urgent pointer: 0
    Options: (12 bytes), No-Operation (NOP), No-Operation (NOP), Timestamps
    [SEQ/ACK analysis]
    [Timestamps]
    TCP payload (186 bytes)
Secure Sockets Layer
    TLSv1 Record Layer: Handshake Protocol: Client Hello

No.     Time           Source                Destination           Protocol Length Info
     22 0.002872       192.168.1.143         192.168.1.130         TCP      66     443 → 61895 [ACK] Seq=1 Ack=187 Win=15552 Len=0 TSval=1680164 TSecr=496067467

Frame 22: 66 bytes on wire (528 bits), 66 bytes captured (528 bits)
Ethernet II, Src: Vmware_ae:e4:60 (00:0c:29:ae:e4:60), Dst: Apple_4a:f3:1f (c8:2a:14:4a:f3:1f)
    Destination: Apple_4a:f3:1f (c8:2a:14:4a:f3:1f)
    Source: Vmware_ae:e4:60 (00:0c:29:ae:e4:60)
    Type: IPv4 (0x0800)
Internet Protocol Version 4, Src: 192.168.1.143, Dst: 192.168.1.130
    0100 .... = Version: 4
    .... 0101 = Header Length: 20 bytes (5)
    Differentiated Services Field: 0x00 (DSCP: CS0, ECN: Not-ECT)
    Total Length: 52
    Identification: 0xc8c9 (51401)
    Flags: 0x4000, Don't fragment
    Time to live: 64
    Protocol: TCP (6)
    Header checksum: 0xed98 [validation disabled]
    [Header checksum status: Unverified]
    Source: 192.168.1.143
    Destination: 192.168.1.130
Transmission Control Protocol, Src Port: 443, Dst Port: 61895, Seq: 1, Ack: 187, Len: 0
    Source Port: 443
    Destination Port: 61895
    [Stream index: 1]
    [TCP Segment Len: 0]
    Sequence number: 1    (relative sequence number)
    [Next sequence number: 1    (relative sequence number)]
    Acknowledgment number: 187    (relative ack number)
    1000 .... = Header Length: 32 bytes (8)
    Flags: 0x010 (ACK)
    Window size value: 972
    [Calculated window size: 15552]
    [Window size scaling factor: 16]
    Checksum: 0x8488 [unverified]
    [Checksum Status: Unverified]
    Urgent pointer: 0
    Options: (12 bytes), No-Operation (NOP), No-Operation (NOP), Timestamps
    [SEQ/ACK analysis]
    [Timestamps]

No.     Time           Source                Destination           Protocol Length Info
     23 0.003327       192.168.1.130         192.168.1.143         TLSv1    252    Client Hello

Frame 23: 252 bytes on wire (2016 bits), 252 bytes captured (2016 bits)
Ethernet II, Src: Apple_4a:f3:1f (c8:2a:14:4a:f3:1f), Dst: Vmware_ae:e4:60 (00:0c:29:ae:e4:60)
    Destination: Vmware_ae:e4:60 (00:0c:29:ae:e4:60)
    Source: Apple_4a:f3:1f (c8:2a:14:4a:f3:1f)
    Type: IPv4 (0x0800)
Internet Protocol Version 4, Src: 192.168.1.130, Dst: 192.168.1.143
    0100 .... = Version: 4
    .... 0101 = Header Length: 20 bytes (5)
    Differentiated Services Field: 0x00 (DSCP: CS0, ECN: Not-ECT)
    Total Length: 238
    Identification: 0x1f77 (8055)
    Flags: 0x4000, Don't fragment
    Time to live: 64
    Protocol: TCP (6)
    Header checksum: 0x9631 [validation disabled]
    [Header checksum status: Unverified]
    Source: 192.168.1.130
    Destination: 192.168.1.143
Transmission Control Protocol, Src Port: 61896, Dst Port: 443, Seq: 1, Ack: 1, Len: 186
    Source Port: 61896
    Destination Port: 443
    [Stream index: 2]
    [TCP Segment Len: 186]
